{"schema":"tenkings.ai-grader.trusted-rig","version":1,"configurationId":"redacted-dell-fixed-rig-v1","canonicalSha256":"2c80972da97473206429fc42aee8262203d3a322b4d663f8e24e1267490e8847","camera":{"selectorKind":"serial_number","selectorValue":"UNCONFIGURED_DO_NOT_USE","expectedVendor":"Basler","expectedModel":"a2A2448-23gmBAS","expectedDeviceType":"BaslerGigE","expectedTransport":"GEV"},"settings":{"pixelFormat":"Mono8","sensorWidth":2448,"sensorHeight":2048,"offsetX":0,"offsetY":0,"exposureMicroseconds":45000,"gain":0,"exposureAuto":"Off","gainAuto":"Off","acquisitionMode":"Continuous","triggerSelector":"FrameStart","triggerMode":"Off","triggerSource":"Software","lineSelector":"Line2","lineMode":"Output","lineInverter":true,"lineSource":"ExposureActive"},"preview":{"framesPerSecond":15,"jpegQuality":72},"queue":{"outputQueueSize":1,"previewGrabStrategy":"LatestImages","forensicGrabStrategy":"OneByOne"},"output":{"formats":["png","tiff"],"losslessMono8":true,"normalizedWidth":1200,"normalizedHeight":1680},"calibration":{"calibrationId":"redacted-fixed-rig-calibration-v1","calibrationSha256":"1218d5d01e21a67cbc0bbfb43da51368c3d468b23db99f3e90852325c4807d57","safeRoi":{"x":0.015,"y":0.015,"width":0.97,"height":0.97},"lens":null,"orientation":{"rotationDegrees":90,"mirrorX":false,"mirrorY":false,"supportsMirrorX":false,"supportsMirrorY":false}},"orientation":{"rotationDegrees":90,"mirrorX":false,"mirrorY":false,"supportsMirrorX":false,"supportsMirrorY":false},"timeouts":{"initializeMilliseconds":5000,"openMilliseconds":5000,"configureMilliseconds":3000,"grabMilliseconds":2000,"drainMilliseconds":2000,"shutdownMilliseconds":2000}}
